{
  "schema_version": "1.0",
  "project_id": "project-demo-001",
  "draft_id": "draft-demo-001",
  "base_revision_id": "rev-001",
  "draft_sequence": 1,
  "timeline_sha256": "1111111111111111111111111111111111111111111111111111111111111111",
  "head_transaction_sha256": "2222222222222222222222222222222222222222222222222222222222222222",
  "timeline": {
    "schema_version": "1.0",
    "timeline_id": "timeline-rev-001",
    "project_id": "project-demo-001",
    "revision_id": "rev-001",
    "duration_us": 800000,
    "frame_rate": { "numerator": 30, "denominator": 1 },
    "canvas": { "width": 2560, "height": 1440, "aspect_ratio": "custom" },
    "tracks": [
      {
        "track_id": "track-main",
        "kind": "main_video",
        "order": 0,
        "visible": true,
        "locked": false
      }
    ],
    "clips": [
      {
        "clip_id": "clip-main",
        "track_id": "track-main",
        "source_id": "source-screen-001",
        "source_start_us": 200000,
        "source_end_us": 1000000,
        "timeline_start_us": 0,
        "timeline_end_us": 800000,
        "enabled": true
      }
    ],
    "operation_ids": ["operation-trim-001"],
    "zoom_ids": [],
    "speed_ids": [],
    "created_at": "2026-09-12T12:00:00.000Z"
  }
}
